<?xml version="1.0" encoding="UTF-8"?>
<!DOCTYPE library SYSTEM "library.dtd">
<library>
    <book>
        <title>Introduction to XML</title>
        <author>
            <firstName>John</firstName>
            <lastName>Doe</lastName>
        </author>
        <publicationYear>2020</publicationYear>
        <ISBN>ISBN-2020-001</ISBN>
    </book>

    <book>
        <title>Programming in Java</title>
        <author>
            <firstName>Jane</firstName>
            <lastName>Smith</lastName>
        </author>
        <publicationYear>2019</publicationYear>
        <ISBN>ISBN-2019-002</ISBN>
    </book>

    <!-- Add more books as needed -->

</library>
